{
  "$schema": "http://json-schema.org/draft-04/schema#",
  "type": "object",
  "properties": {
    "log_path": {
      "type": "string"
    },
    "output": {
      "type": "string"
    },
    "redesign_results_file_path": {
      "type": "string"
    },
    "cache_dir": {
      "type": "string"
    },
    "start_activity": {
      "type": "string"
    },
    "end_activity": {
      "type": "string"
    },
    "post_knockout_activities": {
      "type": "array",
      "items": [
        {
          "type": "string"
        }
      ]
    },
    "success_activities": {
      "type": "array",
      "items": [
        {
          "type": "string"
        }
      ]
    },
    "known_ko_activities": {
      "type": "array",
      "items": [
        {
          "type": "string"
        },
        {
          "type": "string"
        },
        {
          "type": "string"
        }
      ]
    },
    "exclude_from_ko_activities": {
      "type": "array",
      "items": [
        {
          "type": "string"
        }
      ]
    },
    "attributes_to_ignore": {
      "type": "array",
      "items": [
        {
          "type": "string"
        }
      ]
    },
    "rule_discovery_algorithm": {
      "type": "string"
    },
    "confidence_threshold": {
      "type": "number"
    },
    "support_threshold": {
      "type": "number"
    },
    "max_rules": {
      "type": "integer"
    },
    "k": {
      "type": "integer"
    },
    "n_discretize_bins": {
      "type": "integer"
    },
    "dl_allowance": {
      "type": "integer"
    },
    "prune_size": {
      "type": "number"
    },
    "always_force_recompute": {
      "type": "boolean",
      "default": true
    },
    "ignore_log_parsing_cache": {
      "type": "boolean",
      "default": false
    },
    "print_rule_discovery_stats": {
      "type": "boolean",
      "default": false
    },
    "grid_search": {
      "type": "boolean",
      "default": false
    },
    "param_grid": {
      "type": "object",
      "properties": {
        "k": {
          "type": "array",
          "items": [
            {
              "type": "integer"
            }
          ]
        },
        "n_discretize_bins": {
          "type": "array",
          "items": [
            {
              "type": "integer"
            }
          ]
        },
        "dl_allowance": {
          "type": "array",
          "items": [
            {
              "type": "integer"
            }
          ]
        },
        "prune_size": {
          "type": "array",
          "items": [
            {
              "type": "number"
            }
          ]
        }
      }
    },
    "read_options": {
      "type": "object",
      "properties": {
        "column_names": {
          "type": "object",
          "properties": {
            "Activity": {
              "type": "string"
            },
            "Case ID": {
              "type": "string"
            },
            "Resource": {
              "type": "string"
            },
            "lifecycle:transition": {
              "type": "string"
            }
          },
          "required": [
            "Activity",
            "Case ID",
            "Resource",
            "lifecycle:transition"
          ]
        },
        "one_timestamp": {
          "type": "boolean"
        }
      }
    },
    "skip_temporal_holdout": {
      "type": "boolean",
      "default": false
    }
  },
  "required": [
    "log_path",
    "output",
    "redesign_results_file_path",
    "cache_dir"
  ]
}

