{
  "log_path": "inputs/BPI_Challenge_2013_incidents.xes",
  "output": "./outputs",
  "redesign_results_file_path": "outputs/bpi_2013.txt",
  "cache_dir": "cache/bpi_2013",
  "start_activity": "A_Create Application",
  "post_knockout_activities": [
    "A_Denied"
  ],
  "success_activities": [],
  "known_ko_activities": [],
  "exclude_from_ko_activities": [
    "End"
  ],
  "attributes_to_ignore": [
  ],
  "rule_discovery_algorithm": "RIPPER",
  "confidence_threshold": 0.5,
  "support_threshold": 0.1,
  "max_rules": 3,
  "k": 2,
  "n_discretize_bins": 20,
  "dl_allowance": 1,
  "prune_size": 0.5,
  "always_force_recompute": true,
  "print_rule_discovery_stats": true,
  "grid_search": false
}